<?xml version="1.0" encoding="UTF-8"?>
<!--Sample XML file generated by XMLSpy v2008 sp1 (http://www.altova.com)-->
<TRANSACTIONS xsi:noNamespaceSchemaLocation="Transaction3.0.xsd" xmlns:xsi="http://www.w3.org/2001/XMLSchema-instance">
	<TRANSACTION type="AQT" sequence_number="0">
		<TRAN_DETAILS>
			<GRS_MATCHING_ID>a</GRS_MATCHING_ID>
			<TRAN_ID>0</TRAN_ID>
			<TRAN_DATE>1967-08-13</TRAN_DATE>
			<TRAN_TIME>14:20:00.0Z</TRAN_TIME>
			<CARD_NUMBER>a</CARD_NUMBER>
			<MEMBER_ID>a</MEMBER_ID>
			<TRAN_AMOUNT>0.0</TRAN_AMOUNT>
			<NET_AMOUNT>0.0</NET_AMOUNT>
			<REFERENCE_NUMBER>a</REFERENCE_NUMBER>
			<STORE_ID>a</STORE_ID>
			<TRAN_TYPE>S</TRAN_TYPE>
			<LOAD_DATE>1967-08-13</LOAD_DATE>
			<CURRENCY_CODE/>
			<AUTHORIZATION_CODE/>
			<BATCH_NUMBER/>
			<DEBIT_INDICATOR/>
			<ENTERED>C</ENTERED>
			<TERMINAL_ID/>
			<PROCESS_DATE>1967-08-13</PROCESS_DATE>
			<BANK_NAME>a</BANK_NAME>
			<VENDOR_NAME>a</VENDOR_NAME>
			<QUALIFIED_FOR_FREQUENCY>T</QUALIFIED_FOR_FREQUENCY>
			<QUALIFIED_FOR_BONUS>T</QUALIFIED_FOR_BONUS>
		</TRAN_DETAILS>
		<QUALIFIED_FOR>
			<OFFER_ID>a</OFFER_ID>
		</QUALIFIED_FOR>
		<REWARD type="OFR">
			<PARTIAL_AWARD_FLAG>T</PARTIAL_AWARD_FLAG>
			<OFFER_ID>a</OFFER_ID>
			<PRODUCT_ID>0</PRODUCT_ID>
			<MANUAL_TRANSACTION_IND>T</MANUAL_TRANSACTION_IND>
			<MERCHANT_AMOUNT>0.0</MERCHANT_AMOUNT>
			<MEMBER_AMOUNT>0.0</MEMBER_AMOUNT>
			<CLUB_AMOUNT>0.0</CLUB_AMOUNT>
			<TRAN_ID>0</TRAN_ID>
		</REWARD>
		<DISQUALIFIED>
			<OFFER_ID>a</OFFER_ID>
			<DISQUALIFIED_CODE>aaa</DISQUALIFIED_CODE>
		</DISQUALIFIED>
	</TRANSACTION>
</TRANSACTIONS>
